ลำดับ,รหัสประจำตัวประชาชน,คำนำหน้า,ชื่อ,สกุล,วันเกิด,เบอร์โทรศัพท์,ระดับชั้น,ประเภทนักเรียน,บ้านเลขที่,หมู่ที่,บ้าน,ตำบล,อำเภอ,รหัสไปรษณีย์
1,1-4199-01858-55-5,นางสาว,นิลาวัณย์,จันทนะ,'13/07/2542','0934652383',"มัธยมศึกษาปีที่ 4 ","ประเภทนักเรียนมัธยมศึกษาปีที่ 3 (นักเรียนเดิม)",777/2,15,-,พันดอน,กุมภวาปี,41370
2,1-6699-00414-42-2,นางสาว,"สุภาวดี ",แย้มพุฒ,'27/05/2543','0956126465',"มัธยมศึกษาปีที่ 4 ",ประเภทนักเรียนทั่วไป,26,6,-,หอไกร,บางมูลนาก,66120
3,1-1399-00309-74-1,นาย,ภานุวัฒน์,ยี่สุ่นซ้อน,'23/09/2542','0866252950',"มัธยมศึกษาปีที่ 4 ","ประเภทนักเรียนมัธยมศึกษาปีที่ 3 (นักเรียนเดิม)",71/1,10,พิมานคอนโด,ศิลา,ในเมือง,40000
4,1-1399-00309-37-3,นาย,เฉลียง,เอียงตรง,'17/11/2541','0865505835',"มัธยมศึกษาปีที่ 4 ","ประเภทนักเรียนมัธยมศึกษาปีที่ 3 (นักเรียนเดิม)",8,8,-,เชียงพัง,หน่องใส,11111
5,1-1037-02693-95-6,นางสาว,อธิติยากร,บิณฑสูตร,'28/10/2541','0828850283',"มัธยมศึกษาปีที่ 4 ","ประเภทนักเรียนมัธยมศึกษาปีที่ 3 (นักเรียนเดิม)",124/3,-,-,-,หล่มสัก,67110
